Номер;Рецепт
60;в высокий стакан наливаем сыворотку и сок лимона апельсина добавляем джем  взбиваем погружным блендером примерно минуту на высокой скорости  и вот метаморфоза  объем жидкости увеличился в  раза и вместо зеленовато прозрачной  она стала белоснежно пенной переливаем в стакан и наслаждаемся  здесь с манго и апельсиновым соком  
61;вот такая у нас клубничка  натираем её  на терке  конечно  можно и в блендере  но  тогда не будут попадаться кусочки ягод  а с ними вкуснее   такой смузи лучше кушать ложечкой  так как он не совсем жидкий  распределяем по бокалам  наливаем кефир и добавляем сахар  я брала коричневый  или мёд  размешиваем и наслаждаемся   приятного аппетита  
62;лимоны промыть  обрезать попки  разрезать на  части и удалить косточки если есть  сложить лимоны в чашу блендера  добавить сахар и пюрировать до однородности  в кастрюльку добавить чай  цитрусовое пюре и залить кипятком  довести до кипения  выключить и дасть настояться в течении   минут  можно дольше   если есть время   заварку  процедить  попробовать на сахар  остудить и разбавить минеральной водой с газом или простой кипяченой водой до того вкусового состояния  как вам нравится  приятного вам аппетитна                   
63;из апельсинов и лимона выжать сок через насадку для цитрусовых в воду добавить сахар  размешать и довести до кипения   затем добавить крупно порезанные корки от апельсина и лимона  дать закипеть  и уменьшив огонь проварить все минут    выключить огонь и дать сиропу полностью остыть и настояться  чтобы быстрее остыл можно поставить в раковину с холодной водой  из остывшего сиропа убрать корки  а получившийся сироп процедить в банку или кувшин  смешать с выжатым ранее соком  и поставить в холодильник для охлаждения вкусный освежающий напиток готов  
64;  петрушку  лимон  сахар взбить в блендере  я взбивала    мин    добавить холодной воды   гр и хорошо взбить   секунды  при необходимости   повторить    долить остальную воду и еще  секунды взбить    поставить в холодильник на  мин достать  процедить  через мелкое сито  я цедила через марлю    чтобы напиток был прозрачный     всё       вкус похож на напиток из лайма  
65;итак  берем  лимон  нарезаем его вместо с цедрой  кладем в литровую банку  столовую ложку мёда  если вам надо  заливаем кипятком и даём настояться не менее  часов  вкусно     девочки  я люблю кисленькое  отлично уталяет жажду  у меня почки больные  постоянные отеки   лимончик помогает снять отеки  как выпьете   заливайте снова  будет не так концентрировано  но тоже вкусно    
66;банан очистить и нарезать крупными кусочками   в чашу блендера влить молоко и положить  г мороженого   молоко с мороженым взбить несколько секунд   добавить банан и взбивать еще несколько секунд   затем добавить оставшееся мороженое и взбивать  пока масса не станет однородной   в самом конце взбивания влить коньяк   разлить коктейль по бокалам украсить ломтиком киви  банана или апельсина и сразу подавать   приятного вам аппетита  
67;поставить кастрюлю с водой на огонь в это время очень хорошо промыть изюм и курагу и залить крутым кипятком яблоки помыть и нарезать тонкими пластинками прямо с кожурой когда водичка закипит опустить в нее яблоки и изюм с курагой прямо с этой водичкой в которой замачивали далее на среднем огне варим компот около  мин пока яблоки не станут достаточно мягкими в конце варки добавим сахар выключим огонь накроем компот крышкой и оставим в таком виде охлаждаться за это время компот настоится и станет ароматным вот и всё можно угощать компотом малышей и себя  очень  вкусный напиток  
68;в блендере измельчить банан и вишню  влить кефир  добавить мед и ванильный сахар  хорошо перемешать  подавать охлажденным со свежей мятой  приятного всем аппетита     
69;если нет свеже мяты жаль но выход есть заварим в горячей воде сухую мяту остудим и процедим  киви чистим режем на кусочки листья петрушки и мяты крошим произвольно лимон тоже режем на несколько частей  всё закладываем в чашу блендера добавляем воду всё измельчаем смешиваем  переливаем в стакан и выпиваем   будте здоровы красивы и стройны  
70; какао нужно брать хорошего качества  без добавок   в рецепте указано  г шоколада и  шоколадных капель  я их не нашла   осторожно с мускатным орехом  порция больше  грамм в день можеть вызвать галюцинации специи брать по вкусу  если что то не нравиться  можно исключить  а ещё можно добавить жгучий перец  но это уже на любителя  я половину шоколада перемолола в блендере оставляя его слегка крупноватым   ну это вместо капелек остальной шоколад поместить в чашу блендера вместе с сахаром и взбить до порошка   добавить остальные ингредиенты и ещё раз прокрутить   добавить капельки или крупномолотый шоколад   перемешать и расфасовать по баночькам или хранить в сухом месте   для напитка добавить  столовые ложки приготовленого порошка в кружку горячего молока или воды и наслаждаться ароматным согревающим шоколадным напитком  для подарка красиво украсить баночку и на маленькой открыточке написать метод приготовления например    столовые ложки на стакан горячей жидкости 
71;корочки   фруктов  апельсины мандарины лимоны грейпфруты  залить  мя литрами кипящей воды   мякоть можно просто съесть    а вот и двойная выгода      настаивать сутки потом достать корочки перекрутить на мясорубке  воду  ту же  снова довести до кипения и опять залить перекрученные корочки  снова настаивать сутки  после этого процедить добавить  кг сахара подогреть до растворения сахара добавить  ч л  лимонной кислоты  готово  сироп разводить нужным количеством воды  очень приятный и освежающий напиток   
72;берем крепкую заварку с черного чая без всяких ароматических добавок   к примеру чай с бергамотом    и потом завариваем заварку для настоя без них  гриб не любит эссенций и ароматизаторов  только чай и травки   типа ромашки  шалфея    значит взяли заварку  налили ее в банку например в   литровую наполовину и поставили на кухне куда  то наверх где тепло  я поставила на шкаф под потолок прямо рядом с газовой плитой  когда готовишь весь горячий воздух подымается наверх  а нам это и надо  через   дня чай начнет плесневеть  это и есть зародыш нашего будущего гриба  да  чуть не забыла  прикройте чем то банку  марлей или тряпочкой во избежание попадания туда дрозофилл  любят они всякую кислятинку и плесневинку      так выглядит наш гриб на  день его развития  и так ждем    месяца  ничего не делаем  просто ждем    плесень разрастается  потом становится маслянистой пленочкой  то уже самый что ни на есть настоящий гриб  тока маааааааленький    прошел месяц  наша пленочка медузка окрепла  вынимаем ее из баночки и кладем в мисочку  наливаем туда раствор яблочного уксуса с теплой едва водичкой  промываем его очень аккуратно  чтобы не повредить пленочку  завариваем чай из расчета на  литр  чайные ложки чая  я заваривала с зеленого  потому что из него настой гриба еще во сто крат полезней чем с черного  значит взяли банку в  литра  туда вылили остывший процеженный от чаинок чай и подслащенный  на  литр чая   столовых ложек сахара  на гриб ни в коем случае этот раствор не выливать  нерастворенный сахар может его обжечь  а потом выложили гриб в раствор  накрыли марлей и поставили в теплое место на той же кухне  и чтобы солнце не попадало  раствор стоит  дней  сливаем в  литровую банку  оставляя на дне милилитров    гриб выложили в миску  снова приготовили чай  подсластили  остудили  вылили в банку  выложили гриб и снова настаиваем неделю  тот раствор что готов или выпиваем сразу или храним в холодильнике  
73;домашний тархун получается не таким зеленым из за отсутствия красителей  но освежающим и полезным      понадобится  большой пучок эстрагона  примерно  гр     литра минеральной воды   стакан сахара   лайма  эстрагон измельчаем блендером  добавив немного воды  можно просто мелко нарезать и хорошенько подавить толкушкой  добавляем лаймы  порезанные кружочками и сахар  еще раз толчем  лаймы должны дать сок  добавляем  мл миниральной воды  оставляем примерно на   минут  затем процеживаем через марлю и добавляем остальную воду и лед  тархун готов домашний безалкогольный мохито с клубникой  делаем мохито безалкогольный  пучок мяты  лайм несколько штук клубники спрайт много льда  мяту промыть  стряхнуть воду  слегка отбить деревянным молоточком листики мяты и положить в бокал  лайм порезать кружками  разрезать их напополам и тоже положить в бокал  теперь аккуратно вилкой слегка рязмять листья мяты и лайм прямо в бокале  насыпать лед  много льда  половинки ягод клубники положить также в бокал  залить спрайтом  готово апельсиновый напиток  для приготовления   больших апельсина  ст л сахара  палочка корицы  см гвоздика   штучки   лимона щепотка мускатного ореха из апельсинов выжать сок и вылить в кастрюлю  влить  стакан воды  добавить сахар  корицу и гвоздику и на сильном огне довести до кипения  снять с огня и дать остыть  добавить сок   лимона  охладить  процедить напиток в бокалы  добавить лед и посыпать мускатным орехом  украсить кружком апельсина   край бокала цветной кокосовой стружкой по желанию томатный напиток  приготовление  на   томатного сока   лимона  зубчика чеснока соль  перец сельдерей  зелень укропа в томатный сок добавляем по вкусу соль  перец  мелкорубленную зелень укропа  чеснок  натертый на мелкой терке  хорошо перемешиваем  наливаем в бокал или стакан  добавляем в стакан несколько стеблей сельдерея  даем постоять  чтоб сок впитал аромат сельдерея  такой напиток очень хорошо подойдет к любому блюду из картофеля  буду рада  если рецепты моих напитков вам пригодятся     
74;целые сливы моем и укладываем в банку  любой емкости  до верха  засыпаем сахаром  постукивая банку  чтобы сахар заполнил пространство между сливами вот так выглядит подготовленная банка со сливами заливаем сливы с сахаром водкой  закрываем крышкой и ставим в темное место примерно на месяц полтора  первые   дня нужно встряхивать иногда банку  чтобы сахар растворялся  желательно подставить какую нибудь тарелку под банку  так как жидкость может подняться  с литровой банки у меня получилось пол литра наливки по такому же типу я делала наливку из фейхоа  очень интересно получилось   
75;у арбуза удалить косточки и вместе с лимоном перемолоть блендером добавить сахар  развести водой  положить мяту и эстрагон  по желанию   закрыть и поместить в холодильник на час процедить и подать приятного аппетита в жару самое то  очень освежает  лимончик дает неповторимый вкус  
76; в заварочный чайник  кладем     на  чашки    ст  ложка черного чая   ст  ложка сухой мяты  цедру с одного небольшого апельсина для снятия цедры использую терку для сыра  быстро и удобно  заливаем кипятком и даем настояться  в это время выжимаем сок с апельсина затем наливаем чай в чашки  и в чашки уже добавляем апельсиновый сок  от сока чай помутнеет  но пусть вас это не пугает  чай очень ароматный  с приятной апельсиновой  кислинкой  в холодный вечер  лучше не придумать  угощайтесь    на нижнем фото чай еще без сока  на самом верхнем фото  уже с соком   
77;напитка получается на две порциимолоко вскипятить с сахаром и солью снять с огня и в него вкинуть шоколад   поломанный на кусочки   что бы растаял  затем довести до кипения сок и   влить его в шоколадную смесь  напиток можно пить и горячим и холодным смачного 
78;подготовить ингредиенты  в миску налить холодную воду  выложить смородину и хорошо промыть ягоды  при необходимости  несколько раз меняя воду   откинуть смородину на дуршлаг  дать жидкости хорошо стечь  затем аккуратно снять ягоды с кистей   переложить смородину в чистую миску и слегка раздавить ягоды вилкой или ложкой  затем протереть через сито  отжимая из ягод сок  совет если вы готовите морс в жару  отжатый смородиновый сок можно убрать в холодильник    в кастрюлю выложить ягодный жмых и залить  литром воды  довести до кипения на среднем огне  уменьшить огонь до минимального  и готовить около   минут с момента закипания   в конце приготовления добавить сахар  по вкусу  и хорошо перемешать  кастрюлю с морсом накрыть крышкой и дать настояться около  минут   затем процедить морс через сито и хорошо отжать ягодный жмых  перелить морс в кувшин и дать остыть до комнатной температуры   затем соединить морс с ранее отжатым соком  хорошо перемешать и убрать в холодильник до подачи  приятного вам аппетита  
79;приготовление очень простое   слегка    подогреть воду  положить в неё корицу и лавр  довести до кипения и кипятить  минут  после чего охладить и можно пить  получается очень вкусный и красивый отварчик  для худеющих он большое подспорье  т к  с ним можно потерять в талии до  см  а остальные могут себя побаловать очень вкусным чайком  на вкус он получается сладкий и очень ароматный  для похудения стоит пить один стакан в день на голодный желудок  внимание  есть противопоказания к применению    беременность   кормление грудью   возраст до  лет   заболевания толстого кишечника   болезнь крона   печеночная недостаточность очень вкусный чаёк  рекомендую    
80;  средний банан зрелый но не зеленый  помять вилкой  лучше деревянной толкушкой  в пюре  перемешать с сахаром   залить кипятком  хорошо перемешать  закрыть крышкой и дать настояться  минут   желейную массу процедить через сито  по желанию   подогреть и пить теплым   полезный  киселек  готов  приятного аппетита  
81;черный чай заварить с мятой  клубнику порезать тонкими пластинками  положить в чашку  полить  мёдом  залить настоянной заваркой  по желанию долить кипятка  вот и всё  чай готов     
82;всё смешать в блендере  шейкере или взбить миксером  что я и сделала   охладить  вкуснее на следующий день  по оригинальному рецепту берётся  ст л  растворимого кофе  за неимением такового  я взяла  мл  молока  добавила в него  ч л  с горкой свежемолотого кофе  довела до кипения и остудила  туда же добавила  ст л  какао порошка  т к  не нашла  чудо молоко  в магазине  
