Номер;Рецепт
189;спелые сливы сорвать с дерева или упавшие поднять с земли и разложить на солнце на   дня до их окончательного созревания и для того  чтобы их немного подвялить  во время вяления на солнце кожица слив покрывается грибками  дикие дрожжи   которые способствуют процессу брожения  сливы не моют  если только сильно грязные или в земле  слегка протирают тряпкой  это очень важно  иначе процесс брожения не произойдет  сливы очищаем от косточек и превращает в пюре  на данном этапе можете воспользоваться толкучкой  мясорубкой или блендером  но если ваши сливы хорошо подготовлены  это легко сделать просто руками  в сливовое пюре добавляем воду   и оставляем на   дня в открытой емкости  сверху можно накрыть марлей от попадания мошек  через время мякоть начнет отделятся от сока  а на поверхности появится пена  это указывает на то  что процесс брожения начался  на данном этапе сусло процеживаем через марлю в сосуд для брожения  в зависимости от того  какое вино вы хотите получить  в сливовый сок добавляем сахар   грамм на литр сока для полусухого и  грамм на литр сока для сладкого вина  емкость заполняется на   для удачного протекания процесса брожения на горлышко ставится водяной затвор или надевается перчатка с проколом в среднем пальце  на время брожения емкость переносится в темное помещение с температурой   градусов   брожение вина из слив длится   недель  процесс окончен  когда водяной затвор не выделяет газ  перчатка сдулась   а на дне появился слой осадка  это значит  что пришло время слить молодое сливовое вино с осадка в другую чистую емкость для созревания  минимальное время созревания сливового вина    месяца  созревание происходит при температуре   градусов в плотно закупоренных бутылках   после этого процесса  вино полностью пригодно к употреблению наше сливовое виноготово  полный процесс приготовления смотрите на видео  приятного винопития  
190;удалите у яблока сердцевину и поместите в блендер со всеми остальными ингредиентами  взбейте до однородной массы  приятного аппетита  
191;арахисовую пасту положите в сотейник  влейте немного воды  перемешайте до однородности и добавьте оставшуюся воду  доведите молоко до кипения  убавьте огонь и томите около  минут  добавьте сахар и соль по вкусу  
192;для того чтобы выпить чашечку этого чудесного напитка нам понадобится  все ингредиенты берём по вкусу   в скобках укажу сколько брала я  лимон или лайм  правильнее использовать лайм  но в холодильнике чаще всегда оказывается почему то лимон  лимон можно чуть чуть отжать  с детства мы знаем  что лимоны и апельсины богаты витамином с  который так нам необходим в противостоянии с простудными заболеваниями во время наступления холодов бадьян  звездчатый анис  известен как сильно действующее средство от кашля  он поможет вернуть голос и вылечит охрипшее горло  улучшает пищеварение  очень полезен для маленьких детей  так как уменьшает метеоризм  и для кормящих мам  так как увеличивает количество молока кардамон выводит шлаки и токсины из организма  способствует пищеварению  борется с простудными заболеваниями  в сочетании с корицей кардамон ускоряет обменные процессы в организме  благодаря чему происходит снижение веса гвоздика  составу гвоздики мог бы позавидовать самый дорогой мультивитаминный комплекс  помимо улучшения работы кишечника и способности устранить неприятный запах изо рта  гвоздика имеет уникальное свойство  ускорять восстановительные процессы после физического и психического переутомления  это происходит благодаря входящим в ее состав витаминам группы в корица  это природный антибиотик  она способна бороться с бактериями  грибками и кишечными палочками  корица очень полезна для успокоения нервной системы  для умиротворения  для этого достаточно вдыхать аромат корицы  к тому же  корица обладает согревающим эффектом  таким полезным при простудах и в холодное время года а теперь пора складываем все наши составляющие в прозрачный бокал и заливаем горячей водой  но не кипятком  это очень важно  мед  при воздействии на него кипятка  утрачивает свои полезные свойства  а нам эти свойства необходимы для поддержания здоровья и красоты  даем настояться несколько минут  и пьем марокканский чай  вдыхая аромат и любуясь сквозь стекло игрой наших специй с лимоном и листочками мяты рецепт и текст взят   от сюда                   
193;мандарины моем  обдаем кипятком и чистим  кожуру складываем в стеклянную банку и заливаем водкой  отправляем цитрусовые корки настаиваться на  дня в темное прохладное место  мандарины перекладываем в пакет и отправляем в холодильник  через  дня достаем мандарины из холодильника  режем их небольшими кусочками  косточки выбрасываем  перекладываем кусочки мандаринов в кастрюлю  добавляем к ним бадьян и засыпаем сахаром  оставляем мандарины на  сутки при комнатной температуре  периодически помешивая   через сутки добавляем к мандаринам воду  ставим на плиту и доводим до кипения  кипятим в течении  минут и даем полностью остыть  остывший сироп процеживаем  через мелкое сито или марлю и добавляем к коркам с водкой  которые уже настаиваются  дня  настаиваем еще  дня ликер из мандаринов в темном месте  процеживаем ликер в бутылки  он готов к употреблению крепость полученного ликера  градусов  он очень ароматный  его приятно пить  более подробный процесс приготовления смотрите на видео  приятного времяпровождения  
194;дальгона кофе  холодный молочный напиток  с густой  пышной и сладкой кофейной пенкой   его можно  сделать  без кофейной машины  нам понадобится только блендер или венчик рецепт рассчитан  сразу на две порции  так вам будет проще взбивать дальгону  то есть на одну порцию   одна чайная ложка кофе  на две порции   две ложки кофе   в высокий стакан или кружку насыпаем кофе  добавляем сахар и воду  взбиваем электрическим венчиком или погружным блендером минутки три  четыре до устойчивой вязкой светлой пены    если нет электровенчика  можно у миксера снять один венчик  и вторым так же взбить пенку   консистенция и качество растворимого кофе у всех разная  поэтому  если масса слишком вязкая и плохо взбивается  добавьте ещё одну или даже две чайные ложки  воды  тогда масса быстрее взобьётся в пенуподается напиток в прозрачном стакане  чтобы было видно его слоистую текстуру  в стакан наливаем холодное молоко  и сверху ложкой выкладываем густую пену  можно пробовать и с горячим молоком  тогда у вас получится кофе  латте  и даже готовый заваренный  кофе  украсить воздушной шапочкой дальгоны  
195;молоко с сахаром  корицей и содой довести до кипения  помешивая  поднимется пенка   остудить до комнатной температуры  вынуть палочку корицы  желтки слегка взбить венчиком или блендером  влить молоко  ещё раз перемешать до однородности  поставить на маленький огонь  довести до кипения и варить минут   постоянно помешивая и не давая сильно кипеть  снять с огня  влить ром  подавать напиток горячим    
196;сварите кофе как обычно   я варила в турке  процедите и разлейте по кофейным кружкам для латте  нужно чтобы в каждой кружке соотношение кофе и молока было   горячий кофе разбавить горячим молоком сливки взбить с сахарной пудрой вместо сахарной пудры можно использовать ванильный сахар сливки ложкой выложить на кофе посыпать корицей чтобы сливки немного  расплавились   я подогрела чашки с кофе в микроволновой печи несколько секунд  приятного аппетита  
197;имбирь очистим от кожуры и порежем на небольшие кусочки  зальём воды  ставим на огонь при желании имбирь можно натереть на мелкой терке  чтобы он отдал больше своего вкуса натираем лимонную цедру и добавляем ее в кастрюлю  доводим до кипения и варим   минут затем в кастрюлю добавляем куркуму и варим еще  минут получившуюся смесь переливаем в графин и остужаем до теплого состояния  выдавливаем в графин сок лимона  при этом смесь меняет цвет с насыщенного оранжевого до желтого  добавляем мед  хорошо перемешиваем такой напиток хорошо пить как теплым  так и остывшим наш напиток готов  приятного аппетита  
198;сварите кофе с добавлением корицы  вылейте в чашку  добавьте сахар  коньяк  лимон  перемешайте  дайте немного постоять и наслаждайтесь  приятного  
199;для начала нам нужно выбрать в магазине хороший кокос  он должен быть целым и внутри должно быть как можно больше кокосовой воды  сока   проверить это можно очень просто  потрясите кокос  кокос нужно промыть и открыть его  очищаем кокос от коричневой кожицы  нарезаем мякоть кубиками и измельчаем в блендере  к измельченной мякоти добавляем кокосовую воду  пробиваем и вливаем  мл  кипяченой воды  и хорошо пробиваем в блендере  кокосовую массу пропускаем через сито  отделяем молоко от кокосовой стружки  кокосовое молок готово  стружку нужно просушить и использовать  например для приготовления печенья кокосанки приятного аппетита   
200;молоко доводим до кипения и снимаем с плиты  в молоко добавляем все специи  хорошо перемешиваем и даем настояться  минут  пропускаем через сито  взбиваем блендером до образования пенки  в кружку наливаем мёд и сверху наливаем латте  важно чтобы напиток был уже не горячим не более с  наслаждаемся  можно подавать в охлажденном виде  
201;  берем немытые  это очень важно  иначе брожения не произойдет  виноградные грозди и тщательно обираем с них ягоды   в эмалированном ведре давим руками или толкушкой небольшими порциями виноград до сильного появления сока   затем прикрываем емкость марлей и оставляем для брожения в тепле примерно на   дней  два раза в день массу перемешиваем деревянной лопаткой   после того  как мезга  давленый виноград  поднимется  откидываем на дуршлаг  для стекания сока и отжимаем ее через марлю   далее переливаем в банки чистый виноградный сок и насыпаем сахарный песок  перемешиваем   на горлышко банки одеваем промытую медицинскую перчатку  прокалываем в пальцах иголкой несколько дырочек и плотно обвязываем резинкой по кругу    оставляем вино для брожения на   недели при комнатной температуре  следим за перчаткой  вначале процесса она надувается  а когда сдуется  вино готово   после того  как дрожжи осядут  а вино осветлится  и прекратятся бульки  осторожно процеживаем  во время сцеживания вина следим  чтобы дрожжи не попали в чистые бутылки  укупориваем пробками   виноградное вино выносим в прохладное место примерно на месяц  и в течение этого времени три раза переливаем вино в другие бутылки  оставляя осадок в предыдущих   затем еще месяц отстаиваем вино в прохладном месте и можем дегустировать используя этот рецепт виноградного вина  вы получите примерно  литров полусухого ароматного домашнего напитка  
202;ягоды ежевики помыть  перебрать и удалить хвостики  воду закипятить и остудить до теплого состояния  в  х литровый бутыль насыпать сахар  залить его теплой водой и перемешать до полного растворения сахара  всыпать  стакана ежевики и влить водку  хорошо перемешать  плотно закрыть капроновой крышкой и поставить в кладовку или другое темное  но не холодное место на  недели  через  недели жидкость заметно потемнеет  взять другую посуду и процедить в нее наливку через марлю или широкий бинт  перелить в графин или другую емкость  в которой мы будем подавать наливку и наслаждаться насыщенным ягодным вкусом ягодная наливка  готова  более подробный процесс приготовления смотрите на видео  приятного аппетита  
203;дыню помыть  очистить от кожуры и семечек  нарезать крупными кубиками и положить в чашу блендера  клубнику так же помыть  удалить плодоножки  нарезать пополам и положить к дыне  добавить немножко лимонного сока  мед и хорошо перемешать блендером  подавать охлажденным    
204;вино вылить в кастрюлю добавить корицу гвоздику и перец довести до кипения и проварить несколько минут в другой кастрюле довести молоко до кипения шоколад порубить и залить его молоком перемешать до полного растворения шоколада вино процедить от специй добавить мед и шоколадное молоко все перемешать  разлить по бокалам  
205;итак  с лимонов при помощи терки снимаем цедру  разрезаем лимоны пополам и выжимаем сок  я предварительно вскипятила в емкости воду  и слегка остудила  теперь выливаем в нее цитрусовый сок и бросаем цедру  добавляем половину нормы сахара и мешаем до полного его растворения  мяту мелко рубим вместе с тонкими веточками  высыпаем к сахару  тщательно перемешиваем и высыпаем в лимонад  перемешиваем и даем настояться при комнатной температуре   минут  по истечению времени процеживаем через сито  разливаем по стаканам  добавляем лед  и подаем к столу  
206;перебейте клюкву погружным блендером  клюквенную массу протрите через сито  жмых от клюквы переложите в кастрюлю  добавьте воду  сахар  корицу  душистый перец и бадьян  имбирь очистите и нарежьте тонкими кружочками  добавьте его в чай  кипятите напиток  минут  затем снимите с огня  накройте крышкой и дайте постоять еще   минут  клюквенный отвар процедите через сито  добавьте в него ром и клюквенную массу  
207;берём желтки взбиваем с сахарной пудрой до белого пышного состояния   добавляем ваниль и сгущенку  если нет сгущенки заменить можно варёной сгущенкой продолжая взбивать  после вливаем коньяк или ром продолжая взбивать  посуду для взбивания брать лучше глубокую  так как даже при малой скорости взбивания ликёр будет брызгаться  все ликёр готов переливаем в бутылку   ликёр густотой выходит как тесто на блины  
208;в толстодонную кастрюлю положите кэроб  сахар и розовую воду  поставьте на медленный огонь и нагревайте до карамелизации сахара  ни в коем случае не мешайте карамель ложкой  осторожно влейте горячую воду  доведите до кипения  варите около  минут  остудите и процедите  
209;смородину  у меня красная и черная  перебрать  помыть  мяту  должен быть хороший большой пучок  помыть  залить смородину и мяту водой  довести до кипения  добавить сахар  далее кипятим минут   накрываем крышкой и оставляем настояться на часок  приятного  
210;заварить зеленый чай  нарезать лимон  подавить его с сахаром или медом  в чай добавить лед  и нарезанный лимон  если есть   мяту  для наглядности смотрите видео рецепт заварить красный чай  нарезать клубнику  добавить в чай лед и клубнику  для сладости сахар или мед для наглядности смотрите видео рецепт          заварить черный чай  нарезать персик  в чай добавить лед и персик  для сладости сахар или мед для наглядности смотрите видео рецепт          
