Номер;Рецепт
129;в чашу блендера поместить кусочки арбуза  листики мяты и мед  смешать все ингредиенты в пюре на самой маленькой скорости  смешала на максимальной   ну что с ним церемониться   ввести в смесь йогурт  добавить немного порошка корицы и перемешать вкусно  сын сказал  что можно чуть слаще  а мне в самый раз  приятного аппетита  
130; в рецепте у автора было указано  ч л  имбиря и   ст л  лимонного сока  я же использовала эти ингредиенты на свой вкус   чайная ложка имбиря должна быть неполная  т к  с этим ингредиентом лучше не переборщить  иначе напиток получится жгучим   я старалась натереть его так  чтобы в смузи не попали длинные грубые волокна имбиря из самой серединки  убирала их   приготовление  яблоки очистить от кожуры и сердцевинок  нарезать кусочками  смешать с остальными ингредиентами  залить соком и измельчить погружным блендером  вот и всё  смузи с яблоком и базиликом готов     густоту можно регулировать  добавляя больше или меньше сока   
131;облепиху помять картофелемялкой сок слить  а отстатки залить водой и поставить варить  проварить   минут на медленном огне в это время помыть апельсин и лимон  нарезать дольками отвар облепихи процедить  вернуть на огонь и добавить нарезанные апельсин  лимон и сок облепихи  прогреть  но до кипения не доводить  снять с огня  дать настояться  когда чуть остынет  добавить мед для подачи в бокалы положить дольки лимона и апельсина  залить морсом пить теплым 
132; мл  воды выливаем в кастрюльку  добавляем сахар и имбирь  доводим до кипения  добавляем цедру лимонов  кипятим  минут  выжимаем сок с двух лимонов  клубнику помять   клубнику отправляем в лимонный сок и заливаем имбирно цитрусовым сиропом  даем настояться до полного остывания  затем процедить два раза  сначала через сито  второй раз через сито с салфеткой  добавляем газированную воду  разливаем по бокалом  в бокалы предварительно можно положить лед  и наслаждаемся  
133;от общего объема молока отлить  мл  перелить молоко в кастрюльку смешать с сахаром и солью  довести  до кипения  в стакане с оставшимся молоком смешать яйцо и муку хорошо растереть  тонкой струйкой влить яично молочную смесь в кипящее молоко размешать и проварить на медленном огне примерно  минуты добавить  ваниль  остудить напиток  приятного вам аппетита     
134;персики вымыть  обсушить  разрезать пополам и удалить косточки нарезать персики крупными кусочками  поместить в чашу блендера и пюрировать добавить мороженое  охлажденное молоко или сливки   все компоненты взбить в блендере до появления пенки готовый коктейль разлить по бокалам и подавать охлажденным приятного вам аппетита  
135;смешиваем вино и цедру цитрусовых добавляем коньяк добавляем мед и пряности подогреваем наш глинтвейн до с с  не кипятить перед подачей процедить    напиток после подогревания лучше немного настоять  чтобы специи раскрылись и отдали свой аромат  настаивают глинтвейн в закрытой емкости и в теплом месте   для приготовления напитка лучше использовать целые  а не молотые пряности  молотые пряности хуже отфильтровываются и во время приема напитка могут  попасть в ротовую полость  что создаст неприятные ощущения   глинтвейн не кипятят  а только нагревают   для приготовления напитка можно взять поровну белое и красное сухое вино   в рецепте можно заменить мед сахаром рецепт от бармена андрея гарматы  
136;завариваем зелёный чай в   л воды  внимание когда чистим ананас то помыв его предварительно  кожу  и донышки не выбрасываем заливаем и их   л горячей воды  даём настоятся до  часа  сок из апельсинов выжимаем подойдут любые цитрусовые по вкусу   смешиваем остывший процеженный чай настой остывший и процеженный ананаса сок апельсина и ложку мёда  в кувшин в котором будем подавать нашу  чайнгрию нарезаем кусочками фруктовое ассорти здесь подойдёт всё что у вас есть  фруктов должно быть на   кувшина добавляем к ним сахар  заливаем нашим напитком и даём настоятся в холодильнике не меньше часа если нужно то добавляем лёд можно любителям минералки добавить и её но выбрать с нейтральным вкусом  получился вкусный и полезный напиток и не затратный   
137; приготовление все очень просто  моем клубнику  срезаем листочки  нарезаем базилик  берем лед  у меня  маленьких кубиков  все складываем в блендер  наливаем туда же коньяк  бренди   разбиваем все в течение   секунд  лично я люблю  чтобы клубника была кусочками  так что включаю блендер прерывисто на две три секунды и повторяю раз пять  пока не увижу идеальный для меня результат важно еще раз хочу отметить  что клубника должна быть очень вкусной  такой вариант  что  не понравилась   попробую десерт сделать  не пойдет  невозможно получить великолепный результат из посредственных ингредиентов  конечно же смело используйте зеленый базилик  у него несколько другой вкус и аромат  но результат будет нисколько не хуже  
138;для начала подготовим персиковое пюре здесь имеются  способа  ый если персики очень спелые и мягкие то пюрировать их вынув косточки и пропустить через сито добавить сахар и коньяк  ой как у меня нарезать произвольно персики в жаропрочную форму добавить сахар и коньяк я добавила персиковый виски  запечь в разогретой духовке минут   до мягкости затем пюрировать и перетереть через сито  готовое пюре охлаждаем и храним в холодильнике до часа х в бокал положим несколько ложек пюре и дольём холодным шампанским в моём случае брют в процессе потребления размешиваем коктейль в бокале коктельной ложкой или просто трубочкой  приятного от ланиты  
139;смешиваем вино и цедру цитрусовых добавляем коньяк добавляем мед и пряности подогреваем наш глинтвейн до с с  не кипятить перед подачей процедить    напиток после подогревания лучше немного настоять  чтобы специи раскрылись и отдали свой аромат  настаивают глинтвейн в закрытой емкости и в теплом месте   для приготовления напитка лучше использовать целые  а не молотые пряности  молотые пряности хуже отфильтровываются и во время приема напитка могут  попасть в ротовую полость  что создаст неприятные ощущения   глинтвейн не кипятят  а только нагревают   для приготовления напитка можно взять поровну белое и красное сухое вино   в рецепте можно заменить мед сахаром рецепт от бармена андрея гарматы  
140;очистить и мелко нарезать морковь  очистить  удалить сердцевину и мелко нарезать  яблоки  измельчить морковь и яблоки в блендере до состояния пюре  добавить лимонный сок  разбавить готовое пюре яблочным соком до той консистенции  которую желаете получить  можно оставить и в виде густого пюре  тоже вкусно   можно добавить сахар по вкусу  вот и весь рецепт  просто  вкусно  и полезно  а ещё красиво   
141;миндаль ошпариваем в кипятке и чистим измельчаем в блендере  груши чистим режем и отправляем в блендер  измельчаем добавляем ванильный экстрактили ванильный сахар если хотите то мёд кефир и ещё раз взбиваем  если нужно то охлаждаем у меня и груши и кефир были из холодильника   всё наслаждаемся ароматно вкусно с орешками  приятного аппетита  
142;лимоны вымыть  обсушить  цедру аккуратно натереть на мелкой тёрке  не задевая белый слой  или счистить цедру полосками  так же  не задевая белый слой    очищенные от цедры лимоны разрезать пополам  из половинок выжать сок  вынуть косточки  если есть   в кастрюле вскипятить воду  добавить сахар  размешать до его растворения и снова довести воду с сахаром до кипения  огонь выключить  добавить в сироп лимонную цедру  перемешать  сироп с цедрой охладить до комнатной температуры  в остывший сироп добавить лимонный сок и дрожжи  перемешать  оставить на  минут  после разлить  квас  в подходящие стеклянные банки  или бутылки   добавить в банки изюм  накрыть банки марлей и оставить  квас  в тёплом  лучше тёмном  месте на сутки  после закрыть банки крышками и оставить  квас  в холодильнике ещё на сутки  готовый  квас  процедить приятного аппетита  
143;ягоды размораживаем если они из морозильной камеры  воду ставим на огонь и доводим до кипения добавляем сахар и ягоды даём закипеть на маленьком огне в это время муку разводим водой   мл  вводим тонкой струёй в кастрюлю постоянно помешивая варим минут пять до лёгкого загустения кто любит погуще нужно взять немного больше муки даём остыть и наслаждаемся  приятного от ланиты  
144;подготовить ингредиенты  фрукты и ягоды вымыть  удалить косточки  нарезать на кусочки  залить кипящей водой и варить на маленьком огне  минут  фруктово ягодный компот готов перед употреблением остудить  
145;из винограда   кг  замутил домашнее вино  а сухие виноградные гребешки  те самые  на которых прикреплены виноградины   залил хорошей водкой   с самогоном   на мой вкус  получается лучше  но хорошего самогона в этот раз не было с самогоном сложно и вы не заморачивайтесь  соотношение гребешков и водки  без фанатизма  через пару суток водка окрасилась в янтарный цвет  необходимо добавить пару долек лимона  ягоды можжевельника  и  прозрачный  тёмный гречишный мёд  после добавления мёда вся жидкость помутнеет  радуйтесь  у вас натуральный мёд и это пыльца  на следующий день она осядет  а жидкость просветлеет  теперь остаётся только добавлять гребешки иждать  повода на  гребешках настаивается гораздо быстрее  нежели на дубовых досках в бочке и кроме того  они не обладают нежелательными свойствами дуба или дубовой коры    дегустация показала весьма достойный вкус и вид  осталось дотерпеть до нового года  это непросто    зато праздник удастся на славу   по истечение  х недель цвет напитка изменился  все ингредиенты   лекарственные и натурально природные  до нового года ещё вполне достаточно времени  удачи  важное дополнение от исмаила    если есть спирт  то настаивайте на нём  а по окончании настаивания  разбавьте виноградным соком   напиток не вызывает абстинентного синдрома   у коньяка существует две закуски    ничего  или ломтик яблока  лимоном  цитрусовыми  закусывают пиво  а беконом  огурцом  пельменями    водку   п  проверен на практике  
146;все ингредиенты должны быть холодными фрукты режем кусочками вместе с кожурой в емкость добавляем вино газировку фрукты сахар алькоголь  при подаче добавляем лед так же можно оставить на пару часов в холодильнике сангрия станет еще вкуснее  
147;для начала нужно заварить чай   отмерить мл   пол стакана  и поставить охлаждаться  так же можно хорошо охладить дыню   в чашу блендера положить кусочки дыни   мелиссу   сок лайма и  киви с сахаром если добавляете   пробить всё до однородности на максимальной скорости  добавить холодный чай и ещё раз пробить  налить в стаканы и украсить дыней и мелиссой   выход  порции   киви не добавляла за неимение  а сахар решила сразу не добавлять  а когда попробовала оказалось что не нужен он  
148;  очистить манго от кожуры   смешать мякоть в блендере с апельсиновым соком и ванильным йогуртом  у меня был персик   манго    охладить и разлить по бокалам  наш коктейль готов  
149;вскипятите воду  заварите крепкий чёрный чай в течение  минут  чай по гонконгски традиционно заваривают с помощью специального приспособления  похожего на женский чулок  вот такого  говорят  что именно такой способ заваривания делает чай особенно вкусным  у меня его  конечно же  не было  я воспользовалась обычным маленьким ситом  насыпав в него чай и опустив его в ковш  с кипятком     далее выньте ситечко с чаем  переставьте на другую посуду и перелейте в неё заваренный чай  чтобы он снова прошёл через чаинки  повторите эту процедуру ещё два раза  далее в чай добавляется концентрированное молоко по такому расчёту  на объём одной чашки с чаем должно приходиться от   до   части молока  я положила молоко прямо в чашки  а потом добавила туда чай и сахар и перемешала  вместо концентрированного молока можно применить сгущёное  но т к  оно уже сладкое  то возможно  вам придётся положить его поменьше и напиток будет менее шелковистым    молочный шёлковый чай из гонконга можно пить как горячим  так и холодным  
150; продукты берём произвольное количество зависит от порций и восприятия имбиря    можно брать апельсины или смесь апельсиново мандариновую     сахар лучше не добавлять лучше мёд по желанию  мандарины моем и давим из них сок  имбирь натираем на мелкой тёрке оставляя по   кружочку для украшения  смешиваем имбирь с соком сервируем и наслаждаемся  приятного аппетита  и крепкого здоровья  
