Номер;Рецепт
265;для приготовления орехового молока вам понадобятся орехи  вода и сахар  арахис очистите от шелухи  орехи измельчите в блендере до состояния мелкой крошки  чем мельче  тем лучше  залейте ореховую крошку небольшим количеством воды и снова взбейте в блендере  добавьте сахар и оставшуюся воду и опять взбейте  возьмите кастрюлю  сверху положите сито  на сито уложите несколько слоёв марли и процедите молоко   молоко из орехов готово  оно получается нежно кремового цвета  ореховое молоко можно пить просто так или готовить на нём оладьи  каши и т п  приятного аппетита   
266;подготовьте апельсины  воду  сахар  лимонную кислоту  апельсины нужно промыть  обдать кипятком и на ночь положить в морозилку  вынуть  разморозить  нарезать на ломтики  перекрутить на мясорубке или в блендере  залить пюре  литрами чистой воды  дать постоять  минут  процедить  добавить сахар и кислоту  перемешать  дать постоять ещё  час  лимонад готов  
267;ингредиенты  молоко  шоколад  арахисовая паста  маршмеллоу  в небольшом ковшике соединить молоко  шоколад и пасту  нагревать на среднем огне  пока шоколад не растопится и напиток не станет однородным  помешать ложкой  разлить по бокалам  украсить по желанию маршмеллоу  
268;набор и соотношение ингредиентов для коктейля шприц весьма многовариантны  поэтому я сейчас постараюсь объяснить общий принцип  около   или   жидкостей составляет  из  итальянских аперитивов     или   все они имеют красновато коричневато оранжевый оттенок  все слегка горчат  все имеют выраженную апельсиновую ноту  то  что интернациональная ассоциация барменов закрепила за венецианским шприцем апероль  произошло исключительно  благодаря рекламной компании этого продукта  имевшей место в сравнительно недавнем  году  а в италии шприц исторически пьют и с тем  и с этим  как раз прошлым летом разговаривала с официанткой на побережье около венеции  она сказала  что в последнее время клиенты хотят с аперолем  поэтому они и делают с аперолем  но ещё  лет назад это не играло никакой роли  всё делали  кому как нравилось  кроме крепкого аперитива  в шприце обязательно присутствует лёд  лёд туда идёт кубиками  рестораны обычно кладут   на бокал  ассоциация барменов рекомендует полностью заполнять стакан льдом  сервируется шприц с долькой цитрусовых  ассоциация барменов рекомендует апельсин  в реальности это может быть и лимон  в шагах   объясню  почему   в италии шприц иногда сервируется ещё и с оливкой  или даже с листиками мяты  самая путанная часть  это те жидкие составляющие  которые не являются аперитивом  обобщу так  их должно быть больше  чем аперитива  где то     вина используются белые  а не красные  и что нибудь там  да должно быть газированным  в остальном это может быть белое вино из региона венето или просекко  и газировка  если используется только просекко  то оно идёт без газировки  короче  возьмите своё любимое белое игристое  и забудьте про все эти тонкости и подробности  подготовка  отрезаем от лимона или апельсина кружочек  а от кружочка    кроме ваших вкусовых предпочтений  использование лимона или апельсина определяет то  какой бокал или стакан вы используете  в широкогорлый влезет всё  что угодно  а вот в высокий и узкий апельсин  по крайней мере    кружочка просто не поместится  по мнению интернациональной ассоциации барменов  венецианский шприц сервируется в старомодных бокалах  итальянцы придерживаются по этому вопросу своего мнения и сервируют данный конкретный напиток абсолютно во всех видах бокалов  которые подворачиваются им под руку  вплоть для чашевидных под шампанское или двухъярусных для маргариты  в любом случае  из какой бы тары вы ни собирались пить шприц  в неё нужно положить сколько нибудь льда  после заполнения льдом  бокал приблизительно на   заливается аперитивом  поверх аперитива доливается или вино и газировка  или игристое вино  если льда не пара кубиков  а много  или вы промедлите лишнюю минутку с игристым  может случиться так  что аперитив замёрзнет  ляжет на дне и не пожелает смешиваться с игристым  в этом случае покрутите в бокале барной ложечкой  шприц  не слоистый коктейль  на момент подачи он должен быть окрашен равномерно  завершающий штрих  долька лимона  ну  или апельсина  
269;нам потребуется на каждый литр отфильтрованной воды  примерно   грамм ревеня  по веточке лимона  сахар  лимон  каркаде  в кипящую воду  добавляем нарезанный ревень и дольки лимона  убавить огонь  варить около  минут  добавить сахар по вкусу  каркаде  мяту  снять с огня  настоять около  минут   процедить  хорошенько отжать  и охладить  подавать можно с кубиками льда  приятного       
270;для приготовления вишнёво смородинового ликёра нам понадобится чёрная смородина  вишня  вода  спирт  сахар  лимонная кислота  веточки вишни  смородину и вишню с косточками перебрать и промыть  в кастрюлю поместить воду  вишню  смородину  смородиновые веточки  довести до кипения и проварить  минут  вытянуть веточки и процедить отвар  добавить к отвару сахар и лимонную кислоту  довести ещё раз до кипения  охладить  добавить спирт  разлить в бутылки с плотно закручивающимися крышками  оставить для настаивания минимум на  дня  ликёр готов  
271;для приготовления напитка нужно взять сухой каркаде  воду  бутончики гвоздики  палочки корицы  горошины душистого перца  лимон  молотый мускатный орех и сахар  лимон нарезать кружочками  а затем каждый кружочек ещё раз разрезать пополам  в воду всыпать каркаде и все пряности  кастрюлю поставить на огонь и довести до кипения  снять кастрюлю с плиты  плотно накрыть крышкой  укутать в полотенце и оставить на  минут  напиток процедить  подсластить по вкусу и разлить по чашкам  в каждую чашку положить по ломтику лимона и сразу же подавать  
272;нам понадобятся лимоны  сахарный песок  шафран  семена укропа  можно кинзы или базилика   вода  для начала снимем цедру лимона  сделаем несколько надрезов на цедре  очистим цедру с помощью чайной ложки  таким вот образом  очищенную цедру и семена укропа зальём кипятком  через   часа они будут выглядеть вот так  набухшими  из за эфирных масел и семян укропа  настой в итоге получается очень ароматным   процедим  выжмем лимонный сок  добавим сок в лимонный настой  разведите сахар в тёплой воде и влейте в тот же лимонный настой  и настой шафрана  перемешайте  шербет готов  подавайте его со льдом  
273;чтобы приготовить чай  нужно взять кленовый сироп  ром  коньяк   чай чёрный  воду  корицу  мяту  вскипятить воду и заварить чай с двумя палочками корицы  в термобокал положить половину дольки апельсина и дольку лайма  добавить кленовый сироп и ром  коньяк   залить содержимое бокала заваренным чаем  добавить палочку корицы  украсить дольками цитрусовых и мятой  подавать к десерту  
274;для приготовления горячего шоколада с перцем чили возьмём молоко  сливки  свежий перец чили  шоколад чёрный  корицу  имбирь молотый  ванильный сахар  перец чили разрезаем на половинки и удаляем семена  выливаем молоко в кастрюлю  добавляем пряности и перец чили  хорошо нагреваем  но не кипятим  параллельно шоколад ломаем на кусочки  подливаем к нему сливки и ставим на водяную баню  хорошенько всё перемешиваем до однородности  молоко процеживаем через сито и тонкой струйкой вливаем в шоколадную массу  возвращаем тарелку на водяную баню или ставим на слабый огонь  молоко и шоколад хорошенько перемешиваем до однородности и снимаем  разливаем по кружкам и подаём  
275;чтобы приготовить кисель  нам понадобится молоко  морковь  немного воды  сахар  крахмал  ванилин  морковь помыть  почистить  натереть мелко на тёрке  залить морковь небольшим количеством воды и тушить в сотейнике до готовности  в холодном молоке развести кукурузный крахмал  ст  л  размешать  тонкой струйкой влить молоко в морковную смесь  варить  помешивая  пока масса не загустеет  если любите густой  добавьте в молоко чуть больше крахмала  готовый кисель разлить по стаканам  сверху украсить ягодами  подавать  как коктейль  с трубочкой  если кисель жидкий   
276;подготовьте необходимые продукты для приготовления смузи  клубнику  банан и мяту  клубнику   г  очистите от плодоножек  промойте и положите в чашу блендера   банан почистите  поломайте на кусочки и также добавьте в блендер  добавьте промытые листочки мяты   шт    взбейте все подготовленные ингредиенты до получения однородной массы  готовый смузи перелейте в стаканчик  украсьте на свой вкус и незамедлительно подавайте к столу  
277;для работы нам понадобятся огурцы  сахар  лимон  вода  в кастрюле соединить  мл воды и   стакана сахара  довести до кипения  помешивая  чтобы сахар растворился  охладить   г огурцов вымыть и выжать из них сок с помощью соковыжималки  огуречный сок процедить  в сироп добавить огуречный сок и сок  лимона  огуречный лимонад готов  
278;для приготовления коктейля нужно взять свежее молоко  коньяк  сахар песок и воду  в небольшую кастрюльку всыпать сахар  влить воду и перемешать   при непрерывном помешивании довести смесь до кипения  уменьшить нагрев и проварить сироп до состояния светлой карамели  по цвету напоминающей мёд  кастрюлька должна быть небольшого диаметра  так как в ёмкости большого диаметра вода быстро испаряется  и карамель может получиться слишком густой   молоко довести до кипения  вылить его в полученную карамель  перемешать до полного растворения карамели и остудить  вылить в молочную карамель коньяк  и перемешать коктейль  подать коктейль в коктейльных бокалах  
279;подготовим ингредиенты  ром  холодный  очень холодную минеральную сильногазованную воду  холодные листья свежей мяты  тростниковый сахар  холодный лайм для сока и для долек  несколько кубиков льда или дроблённый лёд  подготовим листья мяты  чтоб были чистые  в каждый стакан кладём по   листьев мяты  в зависимости от размера  сыпем в каждый стакан по  ч  л  сахара  вливаем в каждый стакан свежевыжатый сок лайма  и немного придавливаем чем то острым для того  чтоб листья мяты чуть чуть расплющились и дали больше ароматного масла  размешаем  можно  минуты оставить постоять  кидаем по   кубика льда или дроблённый лёд в стаканы  вливаем теперь ром  нарезанные лайм и можно ещё что нибудь по вкусу  надеваем на зонтики  или просто кидаем в стаканы  добавляем газированную воду  ставим украшение с фруктами  коктейль мохито    приятно охладит нас  
280;для приготовления нам понадобится  кофе  чеснок  розмарин  вода  кофе перемолоть  чеснок почистить и разрезать пополам  подготовить маленькую веточку розмарина  в турку закладываем кофе  чеснок  розмарин заливаем водой  готовим на медленном огне  следим за кофе  как только начнёт закипать  снимаем с огня  настаиваем   минуту и можно разливать  кофе готов  предлагаю подать кофе с оливками   
281;подготовьте ингредиенты  вымойте овощи и цитрусы  охладите томатный сок  отмерьте соль  перец и табаско  я использовала табаско хабанеро  но можно взять любой на ваш вкус  выжмите сок из апельсинов и лаймов  нарежьте кусочками огурец вместе с семенами и предварительно очищенный от прожилок сельдерей  смешайте томатный и цитрусовые соки  посолите и поперчите по вкусу  приправьте соусом табаско и перемешайте  добавьте в сангриту нарезанные овощи  перемешайте и охладите напиток в течение часа  охлажденную сангиту разлейте по стопкам и подавайте  
282;для приготовления бичерина нам понадобится вода  молоко  кофе свежемолотый  сливки    сливки    чёрный шоколад  шоколад поломать  соединить с молоком и   сливками  нагреть до кипения  кипятить  минуту  в турке соединить холодную воду и свежемолотый кофе  довести до кипения на медленном огне  при первых признаках закипания сразу снять с огня  горячий кофе процедить  прозрачный стакан на   наполнить горячим шоколадом  горячий кофе перелить в посуду с носиком  в стакан установить лезвие ножа под наклоном таким образом  чтобы кончик ножа доходил до верхней границы горячего шоколада  аккуратно по лезвию ножа налить горячий кофе  слои не должны перемешаться  охлаждённые сливки взбить в пышную пену  выложить сливки сверху на кофе  бичерин готов  
283;для приготовления апельсинового кофе нам понадобится свежемолотый кофе  вода  апельсин  сахар  из половины апельсина выжать сок  кофе с сахаром помещаем в подходящую посуду  заливаем водой и на большом огне доводим до кипения  но закипеть не даём  снимаем в последнюю секунду перед закипанием  накрываем крышкой на  секунд  добавляем в кофе свежевыжатый апельсиновый сок и сразу подаём  
284;для молочного смузи возьмите  на   литра кисломолочного напитка   банана   киви и веточку свежей мяты  бананы и киви очистить от кожуры  мяту промыть и отделить листочки от стебля  фрукты нарезать крупными кусочками  банан  киви и мяту положить в глубокую миску  если вы пользуетесь погружным блендером   взбейте ингредиенты до состояния однородной массы  добавьте к фруктам кисломолочный напиток и взбивайте   минуты  десерт готов  
285;для работы нам понадобится водка  ягоды чёрной бузины  сахар  вода  ягоды бузины промыть  удалить листья и хвостики  для ликёра нам понадобится  грамм ягод  соединить подготовленные ягоды и  грамм сахара  перемешать  накрыть пищевой плёнкой и оставить при комнатной температуре в солнечном месте на  часа  за это время ягоды пустят сок  переложить всё в банку  добавить  мл водки и  мл воды  перемешать и закрыть плотной крышкой  перенести банку в тёмное помещение и оставить на  дней  каждые   дня встряхивать содержимое банки  готовый ликёр процедить  отделив ягоды  по желанию  добавить немного сахара  по вкусу   разлить в бутылки для хранения и оставить на   дня в холодильнике для стабилизации вкуса  после этого профильтровать ликёр через вату  разлить в бутылки и закупорить  ликёр готов  крепкость такого ликёра     хранить в тёмном прохладном месте до  лет  
286;чтобы приготовить персиковый лимонад  нам понадобятся персики  вода  лимон  сахар   литр воды соединить с сахаром   ст  л    довести до кипения  помешивая  чтобы растворился сахар  а затем полностью охладить сахарный сироп  из персиков   шт   снять кожицу и порезать их на кусочки  добавить сахарный сироп и пюрировать блендером до однородной массы  добавить сок из свежевыжатого лимона    шт    лимонад из персиков готов  
