Номер;Рецепт
117;для работы нам понадобится замороженная красная смородина  вода  сахар  отделить  грамм ягод красной смородины от веточек и поместить в кастрюлю  добавить  литр воды  довести смесь до кипения  а затем проварить на небольшом огне ещё  минуту  снять с огня и оставить под крышкой на  минут  отделить ягоды с помощью металлического сита  они нам больше не понадобятся  вмешать  грамм сахара   компот готов к подаче  
118;для работы нам понадобится холодное молоко  свежая черника  сахар  мороженое пломбир в шоколаде  чернику перебрать  промыть под проточной водой  в чашу блендера поместить молоко  сахар и чернику  взбить на протяжении  минут  добавить мороженое  взбить на протяжении  минут  разлить коктейль порционно и подавать сразу же  
119;для приготовления лимонада нам понадобится базилик  лимон  сахар и минеральная сильногазированная вода   сахар насыпать в сотейник и залить водой  поставить на огонь и варить до полного растворения сахара  снять с огня и остудить  перелить в кувшин  выжать сок из лимона   листья базилика вымыть и выложить на бумажное полотенце    пюрировать в блендере листья базилика с лимонным соком  процедить через марлю в кувшин  влить минеральную воду и тщательно перемешать    разлить по бокалам и добавить кубики льда  приятного     
120;для работы нам понадобится банан  киви  смесь апельсинового и персикового сока  семена чиа  залить  грамм семян чиа  мл сока и оставить на  минут для набухания  половину банана и  киви очистить и нарезать небольшими кусочками  соединить остальной сок   мл  с бананом и киви  измельчить с помощью блендера  добавить семена чиа вместе с остальным соком  еще раз измельчить  смузи с чиа готов к подаче  
121;для того  чтобы приготовить кисель из апельсинов потребуются апельсины  сахар  крахмал картофельный и бадьян звёздочкой  из  крупных апельсинов выжать сок  у меня получилось   мл  жмых выложить в кастрюлю  налить в кастрюлю  стакана холодной воды  проварить  жмых   минут  отвар жмыха процедить и добавить сахар по вкусу  мне хватило  столовые ложки  в отвар жмыха вылить   часть выжатого апельсинового сока  во второй части апельсинового сока растворить  столовые ложки крахмала  отвар жмыха с апельсиновым соком и сахаром довести почти до кипения и влить сок с крахмалом  перемешать до загустения киселя   минуты и выключить   в горячий кисель добавить  звёздочки бадьяна  готовый кисель разлить по стаканам и подать на десерт в обед или с пирогом на полдник  
122;для приготовления ягодного кваса нам понадобится ягодный микс  замороженный  по вкусу    грамм   вода  сахар и дрожжи сухие  если заменять прессованными  нужно взять  граммов   первым делом сварим компот  он будет насыщенным  в кипящую воду закладываем все ягоды в замороженном состоянии  после закипания варим минут  на медленном огне   ягоды полопаются сами  а те  которые все таки остались целыми  подавим черпаком  всыпаем сахар и перемешиваем до его растворения  попробуем компот на сахар  если вам мало  добавьте ещё  даём ещё минуту покипеть и выключаем газ  даём компоту остыть до температуры чуть теплее комнатной  затем процеживаем компот  в стакан отливаем немного компота и растворяем в нём дрожжи  заливаем дрожжи к остальному ягодному компоту  хорошо перемешиваем  прикрываем кастрюлю марлей  чтобы не попадала пыль  и оставляем в кухне часов на    за это время на компоте появится пена  это бродят дрожжи  снимаем пену  процеживаем квас и переливаем его в подходящие бутылки с плотной крышкой  ставим в холодильник на сутки двое  ягодный квас готов  аккуратней с открыванием бутылок  пена может вырваться наружу и залить всё вокруг  наливаем себе стаканчик кваса  даём ему минутку подышать и наслаждаемся  
123;для приготовления напитка понадобится мак  вода  мёд и корица  не является обязательной   мак замочить на пару часов  можно не замачивать  если блендер мощный   затем слить воду через марлю  мак смешивать в блендере  постепенно добавляя воду до тех пор  пока вода не приобретет молочный цвет  на это может уйти от  до  минут  далее добавить мёд и взбить  также можно добавить корицу  но тогда цвет макового молока изменится  подождать пока мак осядет  затем процедить через мелкое сито или марлю  и подавать  хранить максимум  часа в холодильнике  а лучше употребить сразу  
124;для приготовления напитка возьмём облепиху  чёрный чай без добавок и мёд по вкусу  ягоды облепихи хорошо помыть    части подавить мадлером или размять с ложкой в пюре  в чайник всыпать облепиховое пюре  оставшиеся ягоды и чёрный чай  залить всё кипятком  закутать и дать настояться   минут  готовый чай разливать через ситечко  добавив мёд по вкусу   
125;для работы нам понадобится сахар  ванильный сахар  вода  спелые груши  картофельный крахмал   грамм груш очистить от кожуры  удалить семенную коробку  мякоть нарезать ломтиками  соединить в кастрюле с водой   мл   довести до кипения и проварить  минут  или до мягкости груш   измельчить содержимое кастрюли блендером  добавить  грамм сахара   грамм ванильного сахара  довести до кипения и проварить   минуты   мл воды соединить с картофельным крахмалом   ст  л   и перемешать  ввести крахмальную смесь в грушевую  не прекращая помешивания   довести на среднем огне до кипения и проварить  секунд  кисель из груш готов  подавать такой кисель можно как в горячем  так и в холодном виде  
126;для приготовления безалкогольного яблочного сидра возьмём яблоки  мёд  корицу  гвоздику  апельсин  из яблок выжимаем сок и замеряем его количество  выливаем сок в кастрюлю  добавляем мёд  корицу и гвоздику  доводим до кипения  убавляем огонь и варим ещё  минут  процеживаем жидкость от гвоздики и корицы  для подачи тёплый яблочный сидр разливаем в стаканы  апельсин нарезаем дольками и добавляем туда же  так же можно добавить дольки яблока и бадьян  вкусной и тёплой осени вам  
127;подготовим ингредиенты  молодую морковь  стебли сельдерея с листиками  большое яблоко и свежевыжатый апельсиновый сок  все овощи лучше всего употреблять холодными  очищаем от кожуры морковь  нарезаем на кубики яблоки  без серцевинки   морковь и сельдерей  отправляем всё в чашу блендера и вливаем апельсиновый сок   перемалываем содержимое в однородную густую массу  разливаем по стаканам и приятного оздоровления  
128;для приготовления компота взять голубику  сахар и воду  ягоду промыть  залить ягоду холодной водой  довести до кипения и варить минут    добавить сахар по вкусу  довести до кипения и остудить  компот готов  подавать охлаждённым  
129;для приготовления киселя взять ягоды  изюм  крахмал и сахар  ягоды промыть и опустить в холодную воду    л   довести до кипения и сварить хороший компот  для более ярко выраженного вкуса ягод можно помять  тогда их лучше будет отцедить до ввода изюма   варить на медленном огне около  минут  в конце добавить сахар  регулируйте сладость на свой вкус  крахмал высыпать в глубокую миску  в холодной кипячёной воде развести крахмал  в наваристый ягодный компот ввести изюм  ещё поварить минут  до мягкости изюма  кастрюлю снять с огня  чуть остудить и тонкой струйкой  при постоянном помешивании  ввести разведённый крахмал  перемешать кисель до однородности и прогреть до кипения  кисель должен быть однородной густой консистенции  разлить готовый кисель в глубокие миски  охладить и подавать на десерт  очень вкусно  
130;для приготовления морковного сока в домашних условиях нам понадобится морковь  сливки    лимонный сок   г моркови вымыть  очистить от ботвы и кожицы  с помощью соковыжималки выжать морковный сок  процедить сок через мелкое сито  по желанию добавить сливки   ст  л   или лимонный сок   ч  л    свежевыжатый морковный сок готов  
131;ингредиенты  сливки    кофе эспрессо  сахар ванильный  сливки обязательно должны быть горячими  подогрейте их заранее в микроволновке  минуту  добавьте в горячие сливки сахар и размешайте до растворения  в чашу для взбивания влейте сладкие сливки и горячий кофе  взбивайте несколько минут  кофе с идеальной пенкой готов  подавайте немедленно  
132;для приготовления коктейля нам понадобится холодное молоко  мёд  апельсины  мускатный орех  у меня орех  но можно взять уже молотый   взбиваем молоко с мёдом с помощью блендера   минуты до полного растворения мёда  выдавливаем сок из апельсинов  вливаем сок в молоко и ещё раз взбиваем  чтобы появилась пенка  натираем на самой мелкой терке мускатный орех  нам нужна всего лишь щепотка  разливаем коктейль в стаканы  посыпаем сверху мускатным орехом  приятного аппетита  
133;чтобы приготовить кофейный напиток  нужно взять кофе  воду  корицу  мускатный орех  какао порошок  сгущенное молоко  орехи миндаля  какао    ч  л   смешать со сгущёнкой    ч  л   в однородную  гладкую массу  кофе   ч  л   смешать с корицей   ч  л   и мускатным орехом   щепотка    джезву обдать кипятком  всыпать в неё кофейную смесь  добавить горячей воды   мл   сварить кофе  не доводить до кипения  наполнить половину чашки горячим кофе  добавить смесь какао с молоком  перемешать  добавить кофе  посыпать готовый кофе со сгущёнкой молотым орешком миндаля   орешек на чашку   подать напиток на десерт  
134;для  стакана  хайболл  мл  нам потребуется  газированной воды  половинка лайма и огурца  пару веточек мяты  лёд и тростниковый сахар демерара  нарезаем кружочками половину огурца   откладываем для украшения  режем лайм на тонкие ломтики   также откладываем  так как мохито относится к коктейлям типа билд  займёмся его построением прямо в бокале   на дно хайболла кладём лайм  затем огурец  сверху добавляем листья мяты с одной веточки  засыпаем сахаром   столовые ложки  мадлером тщательно разминаем содержимое стакана  чтобы огурец  мята и лайм хорошенько дали сок  засыпаем кубики льда в хайболл  вливаем газированную воду  оставляем пару сантиметров свободными   сверху выкладываем  дольку лайма и кружок огурца  отрываем верхушку второй веточки мяты и оставляем её для декора  оставшиеся листья добавляем в стакан   декорируем хайболл оставшимися кусочками огурца и лайма  добавляем верхушку ветки мяты  освежающий огуречный мохито готов  
135;оба коктейля будут смешаны одинаковыми пропорциями продуктов  но один будет с ромом  а другой с мартини бьянко  и один будет с карамельным сиропом  а другой  с гренадином  то есть гранатовым сиропом  но не наршарабом  а тем  который применяют бармены   ну  и в обоих коктейлях будет гранатовый сок    а не напиток  коктейли будут декорированы семенами граната  но на вкус это никакого влияния не оказывает  стаканы засыпаем льдом полностью  можно даже чуток с горкой  всё равно потом осядет  наливаем по  мл рома  слева  и мартини бьянко  справа   наливаем гранатовый сок  кстати  смотрите  какая уже разница в цвете   наливаем сиропы  карамельный слева  гренадин справа  они соскальзывают на дно  поэтому у  стаканов придонный слой разного цвета  посыпаем сироп гранатовыми зёрнышками  чтобы намекнуть  из чего у нас коктейль сделан  
136;для приготовления малинового айс крима нам понадобится  мороженое пломбир  малиновый сироп  любые фрукты и ягоды ассорти  у меня абрикос  черешня и клубника   очень холодная газированная вода  нарезаем небольшими кусочками абрикос  черешню и клубнику  в охлаждённые стаканы кладём на дно мороженое  поливаем мороженое малиновым сиропом  сиропы и желе для десертов я делаю сама и храню в холодильнике  малиновые и красносмородиновые обычно готовлю без термообработки  выкладываем смесь ягод  заливаем холодной газированной водой  подаём с трубочкой и коктейльной ложкой для фруктов  
137;для приготовления классического какао вам понадобятся  молоко  какао порошок  ванильный сахар и корица  если вы взяли магазинное молоко  то разбавлять его водой не стоит  смешайте в пиале какао порошок  сахар  ванилин и корицу  добавьте в пиалу несколько столовых ложек тёплого молока и перемешайте смесь так  чтобы не было комочков  в разогретое молоко маленькой струйкой вылейте смесь  постоянно помешивая  доведите напиток до кипения и варите  минут на медленном огне  постоянно перемешивая  снимите с огня и накройте крышкой  чтобы напиток настоялся  какао надо варить на медленном огне и постоянно следить за процессом  чтобы молоко не сбежало  
138;для безалкогольного коктейля восход солнца нам нужны или апельсины  или апельсиновый сок  минеральная вода любой степени загазированности и красный сироп  может  остатки варенья    у меня  клубничный  в текиле санрайз есть ещё лёд  но в детском коктейле  думаю  лучше обойдёмся без него  выжимаем апельсиновый сок  из около  г апельсинов выжалось  мл  наливаем в стаканы  в которых будет производиться сервировка  сок или на    или на    в зависимости от этого можно получить коктейль с разной прозрачностью  более прозрачный красивее  менее прозрачный  ясное дело  вкуснее  вливаем газировку  она образует на апельсиновом соке шапочку из пены  а на стенках стакана  красивые пузырьки  вливаем клубничный сироп  он оседает на дно и получается красивый цветовой переход снизу вверх от красного к оранжевому  если хотите  наоборот  чтобы красный задымился внутри стакана  плесните ещё газировки  она всколыхнёт слои  сервировать быстро  иначе пена оседает  а пузырики со стенок улетучиваются  на финальной фотографии спереди стоит стакан с приблизительным соотношением сока и газировки    а сзади    плюс с доливанием воды после введения сиропа  
139;для приготовления морса нам понадобятся лимоны  сахар и вода  снимаем с лимонов цедру как можно тоньше  далее снимаем с лимонов белую мякоть  с лимонов выжимаем сок  получаем  мл сока  сок процеживаем  выжимки и мелко порезанную цедру заливаем водой  добавляем сахар и доводим до кипения  варим с момента закипания   минут  при слабом кипении  и оставляем под крышкой настояться до полного остывания  далее отвар процеживаем  вливаем в напиток сок  наш лимонный морс готов  приятного аппетита  
