Номер;Рецепт
418;для приготовления безалкогольного глёга нам понадобится мускатный орех  мёд  корица  гвоздика  мандариновая цедра  изюм  миндаль  сок яблочный  сок чёрной смородины  вода  в воду добавить мускатный орех  гвоздику  палочки корицы  мандариновые корочки  довести смесь до кипения  огонь выключить  а смесь подержать под закрытой крышкой   минуты  вынуть специи  добавить в пряный отвар чёрносмородиновый и яблочный сок  мёд  довести смесь под крышкой до   с  сразу разлить в бокалы из толстого стекла  добавить в бокалы немного изюма  миндаля и палочку корицы  
419;подготовить тыкву  молоко  сахар коричневый и корицу  мякоть тыквы очистить от шкурки и нарезать произвольными кусочками  посыпать коричневым сахаром  запекать в духовке при   примерно полчаса  тёплую тыкву поместить в блендер  добавить тёплое молоко  щепотку корицы  взбить до однородной массы  разлить по стаканчикам  посыпать немного корицей  подавать сразу же после приготовления  
420;для приготовления кофейно кокосового шейка нам понадобится свежемолотый кофе  сахар  кокосовое молоко  кокосовая стружка  вода  кофе и сахар засыпаем в френч пресс  чтобы удобно было отфильтровать гущу   заливаем кипятком и даём напитку настояться около  минут  или готовим кофе в кофемашине  или кофеварке  затем добавляем сахар  слегка остывший  отфильтрованный кофейный напиток переливаем в чашу блендера  всего нам понадобится  мл кофе  остальная жидкость вместе с кофейной гущей не понадобится  вливаем кокосовое молоко  взбиваем на высокой скорости около   секунд  в процессе взбивания образуется густая пенка  наливаем шейк в высокий стакан  посыпаем кокосовой стружкой и сразу же наслаждаемся  
421;для вкусного  охлаждающего шейка  возьмём  персик  абрикосы  мороженое  у меня домашние из   сливок   кунжут  лёд  кунжут  поджарить на сухой сковороде  фрукты  измельчить и пюрировать  добавить мороженое  взбить  всыпать кунжут  перемешать  в банки  насыпать лёд  можно измельчить   налить шейк  и подаём  смачного     
422;для смузи необходима клубника  молоко  йогурт  овсянка  мёд   в миску  или чашу для блендера  сложить овсянку  молоко  йогурт  мёд   далее туда же добавить помытую  очищенную от хвостиков клубнику  для удобства её лучше всего разрезать пополам   хорошенько измельчить всю смесь блендером  подавать  разлив по стаканам и украсив сверху клубничкой   
423;у истинного лонгайлендца должны стоять джин  водка  текила  ром  трипл сек  это семейство апельсиновых ликёров крепостью выше    кола  лимон  дроблёный лёд и сахарный сироп  первый шаг  который у барменов  как бы по умолчанию  нам необходимо спиралью снять шкурку с лимона  ибо в настоящий момент модно забрасывать в лонг айленд айс ти лимонную спираль  кусочек лимона на бортике  похоже  уже не модно  но допустимо  важный вопрос  сколько лимонов требуется выжать  чтобы добыть необходимые по рецепту  мл лимонного сока  опытным путем я установила  в зависимости от размера лимона это может быть как    так и чуть больше  но не целый лимон  даже если он маленький  кстати  из уже очищенного лимона удобно выжимать сок  проворачивая в нём вилку  самый первый шаг для барменов  это засыпать в стакан лёд  для сервировки лонг айленд айс ти традиционно применяются такие вот высокие круглые стаканы  на профессиональном жаргоне они называются хайбол     дальше бармен начинает плескать в стакан небольшие порции жидкостей  входящих в состав рецептуры  но у барменов  у них ведь глаз алмаз  намётанный  а рука твёрдая и тренированная  им  мл отмерять  это вообще не вопрос   а ещё  кстати  у них есть специальные маленькие мерные стопочки разного объёма   если у вас есть соответствующие навыки и возможности  то можете делать  как бармены  но лично я  как чайник  рекомендую насчёт льда пока подождать  а смешать для начала все жидкости в прозрачной мерной посуде  сначала я волью лимонный сок  использовать бутылочку для детского питания вовсе не обязательно  просто у них  по моему  самая удобная шкала делений для смешения мелких объёмов  есть ещё прозрачные барные шейкеры  такой бы подошёл просто идеально  потом я начну добавлять прозрачные крепкоалкогольные напитки  джин  водку  ром и текилу  по  мл  заметьте  это уже  мл чего то с крепостью чуть меньше   начиная с этого шага  из этой бутылочки для детского питания  детей в возрасте до  лет ни в коем случае не поить  ну  и ещё  мл трипл сек  его отдельно не только потому  что у меня этот ликёр по цвету не светлый  а из за сладости  вниз его не нужно  по крепости он ближе к   чем к   итого  тот  кто выпьет стаканчик лонгайлендского чайку  засадит в себя по градусам лишь чуток меньше  чем  мл водки  всем всё понятно  предпоследним идёт сахарный сироп  так делается по одной простой причине  у него самая большая плотность  и он всё равно будет норовить опуститься на дно  если влить его первым  то размешивать будет труднее  а вот теперь  когда мы смешали почти всё  кроме колы  соблюдая точную пропорцию  мы вполне можем вылить нашу заготовку в высокий круглый стакан  заполненный льдом  кстати  если вы собираетесь подавать лонг айленд айс ти большой толпе народу в рамках меню вечеринки  то его рационально смешать до этого шага на всех  а уж потом по быстрому разливать по стаканам  а кола доливается в последнюю очередь  её количество зависит от того  сколько в стакане льда и каков его объём  у меня на малый хайбол ушло  мл  обратите внимание  кола не легла на дно  она легче остальных жидкостей и зависла вверху стакана  поэтому коктейль нужно перемешать ложечкой с длинной ручкой  ежели вы человек новомодный  то сервируйте лонг айленд айс ти с   спирали  срезанной с лимона  обязательным компонентом является также и трубочка  
424;подготовим ингредиенты  молоко  миндальный мусс  сахар  сливки для взбивания  шоколадный порошок  очень мелкий   смешиваем молоко с сахаром и миндальным муссом  кипятим и сразу убираем в сторону  взбиваем миксером на высоких оборотах холодные сливки с шоколадным порошком в стойкие пики  аккуратно  не перебейте  чтобы не получить масло и сыворотка  разливаем горячее молоко  или остывшее  по стаканам  взбитые шоколадные сливки поместим в кулинарный мешок с любой насадкой   и выдавим на молоко сливки  верх увенчаем красивым узором  сервируем сразу же  с ложкой  приятного аппетита  
425;подготовьте необходимые ингредиенты  чай матча  или тайваньский зелёный порошковый чай   молоко  сгущённое молоко  корень имбиря и ванильный сахар  нарежьте имбирь кусочками  добавьте в молоко вместе с ванильным сахаром и прокипятите на маленьком огне минут   немного холодного молока оставьте  примерно  мл  смешайте остатки молока со сгущённым молоком и чаем  если у вас есть специальная кисточка для матча  воспользуйтесь ей  если нет  тщательно размешайте ложкой или вилкой  залейте получившуюся смесь горячим молоком и перемешайте  имбирь удалите  подавайте напиток в горячем или в холодном виде  холодный напиток можно подать с кубиками льда либо замороженного молока  приятного чаепития  
426;подготовьте необходимые ингредиенты  клубничный джем  банан  пломбир  молоко  все ингредиенты должны быть хорошо охлаждены  влейте в блендер стакан молоко  добавьте кусочки банана  добавьте джем и пломбир  у меня джем с пектином и лимонной кислотой  если ваш джем без лимонной кислоты  добавьте чайную ложку лимонного сока  чтобы банан не потемнел и коктейль сохранил красивый цвет   взбивайте коктейль до однородности  готовый коктейль разлейте по бокалам  охладите и подавайте  приятного аппетита  
427;для приготовления компота ассорти нам понадобится сахар  вишня  смородина  малина  вода  в чашу мультиварки насыпать сахар  ягоды перебрать от листьев и черешков  помыть  засыпать ягоды в чашу мультиварки  налить воду в чашу мультиварки  включить режим варка на пару на  минут  после сигнала об окончании цикла  дать настояться компоту  минут  компот готов  подавать охлаждённым  
428;чтобы приготовить чай  нужно взять цветки календулы  одну палочку корицы  зеленый чай без добавок  имбирь  воду  мёд  цветы календулы помыть  просушить  отделить лепестки и корзинки  почистить и нарезать имбирь  залить водой и поставить на огонь  с момента закипания варить  минут  в заварник сложить календулу  корицу и зеленый чай  залить чай кипятком с имбирем  закрыть крышкой  выдержать  минут  чай готов  чай налить в чашки  украсить лепестками календулы  опустить в чашку палочку корицы  по желанию   к чаю подать сладости и мёд  
429;для глинтвейна с вишней понадобится красное полусухое вино  вишня свежая  свежемороженая   мёд по вкусу и набор пряностей для обычного глинтвейна  корица  гвоздика  бадьян  кардамон  пряности можно подобрать по своему вкусу  подготовить вишню  если у вас вишня свежая  то промыть плоды и вынуть косточки  сохраняя выделяющийся сок  свежемороженую вишню разморозить  удалить косточки  а затем вишнёвую мякоть  вместе с соком  довести до кипения на малом огне  измельчить вишню в блендере  таким образом получаем вишнёвый сок с мякотью  перелить вишнёвый сок в ёмкость  которую можно поставить на огонь  добавить в неё выбранный букет пряностей  палочки корицы  бадьян  кардамон  гвоздику  поставить на огонь и прогреть вишнёвый сок с пряностями на малом огне  не допуская бурного кипения сока  пряности отлично отдают свой аромат и вкус тёплому  вишнёвому соку  через   минут прогревания  можно влить в пряный  благоухающий  вишнёвый сок красное полусухое вино  теперь нужно прогреть вино и сок  также следя за тем  чтобы вино ни в коем случае не закипело  в идеале и для тех  у кого есть кухонный градусник  не более  с   осталось подсластить глинтвейн по вкусу мёдом или обычным сахаром  подавать глинтвейн с вишней  как впрочем и все остальные глинтвейны  следует тёплым  именно в таком виде  он самый полезный и вкусный  приятного аппетита  
430;для работы нам понадобится алыча  вода  сахар  картофельный крахмал  алычу хорошо промыть  опустить в кастрюлю с водой    литра   довести до кипения и проварить на протяжении  минут  алычу вынуть и протереть через металлическое сито  вернуть пюре из алычи в кастрюлю с отваром и вместе с сахаром довести до кипения  в стакане холодной воды размешать крахмал  тонкой струйкой влить крахмальную смесь в отвар  постоянно мешая  довести до кипения и готовить   минуты  кисель из алычи готов  
431;для приготовления морса нам понадобятся голубика  брусника  вода и сахар  сахар  при желании  можно заменить мёдом  ягоды голубики и брусники моем и перебираем  удаляем мятые и порченные  голубика у меня была очень чистая  а вот бруснику пришлось хорошенько перебрать  перетираем ягоды через сито  чтобы ускорить процесс  ягоды можно сначала перемолоть погружным блендером  а потом перетереть  сок с мякотью пока отставляем  а ягодный жмых складываем в кастрюлю  добавляем туда сахар и заливаем всё водой  доводим жидкость до кипения и провариваем минут   затем отвар необходимо процедить  отваренный жмых выбрасываем  он уже отдал весь сок и аромат   в отвар добавляем выжатый сок и прогреваем всё ещё минут   при необходимости добавляем сахар  готовый морс можно пить как тёплым  так и холодным  так как мякоть оседает на дно  перед употреблением морс желательно взболтать  
432;для черничного киселя нам понадобится сама черника  сахар  картофельный крахмал и вода  чернику перебираем  удаляем сор и мятые  порченые ягодки  перетираем чернику через мелкоячеистое сито  чтобы сок легче было выдавливать  можно сначала подавить ягоды чем нибудь плоским  я использую обычно толкатель для мясорубки  складываем ягодный жмых в кастрюлю  добавляем сахар и воду  отправляем на огонь и доводим до кипения  когда отвар закипит  процеживаем его через сито или марлю и возвращаем на огонь  добавляем черничный сок и доводим снова до кипения  крахмал высыпаем в стакан и добавляем негорячую воду  тщательно перемешиваем  добавляем крахмал с водой в кипящий кисель  постоянно его помешивая  чтобы крахмал не схватился одним комком  варим кисель ещё   минуты и выключаем  разливаем в любую удобную тару и подаём  
433;для приготовления нам потребуется зелёный кофе  молоко  вода  смесь специй  а также мёд или сахар по вкусу   у меня кофе в зёрнах  брала его на развес  хранился в большом пыльном мешке  поэтому кофе помою и высушу  кофе берём из расчета   г на порцию   затем кофе слегка прокаливаем на сухой сковороде  сильно не жарим  даём зарумяниться  как почувствуете запах семечек  можно выключать огонь  мелкую плёнку  которая образуется  сдуваем   далее кофе необходимо измельчить  для этого используем кофемолку  но измельчаем не в порошок  или делаем так  зёрна кофе выкладываем на поднос  затем закрываем плёнкой и давим зёрна стаканом   вот  что получится  как раз то  что нужно  не очень мелко  в кастрюлю складываем измельчённый кофе и специи  заливаем водой и варим в течение  минут  в горячий напиток вливаем молоко и варим ещё  минуты   молочный напиток готов  напиток процедить и можно подавать  сахар или мёд можно добавить по вкусу  
434;для приготовления понадобится мороженое  молоко  банан  кофе  любой   корица  готовим кофе любым доступным способом  у меня американо  приготовленный к кофемашине  приготовленный кофе разливаем в формочки для льда  полностью заморозить  далее в чашу блендера кладём очищенный банан  половину кубиков льда из кофе  мороженое  щепотка корицы по вкусу  заливаем молоком и взбиваем на большой скорости  минуту  в стаканы кладём несколько кофейных кубиков  заливаем молочно кофейной массой  и можно подавать   
435;для приготовления понадобится яблочный сок  вода  апельсин  коричневый сахар  гвоздика  перец и корица  снимем цедру с половины апельсина  из мякоти выжмем сок  в кастрюлю выливаем яблочный сок  воду  кладём корицу  гвоздику и перец  доводим до кипения  затем добавляем цедру и сахар  держим на медленном огне около  х минут  затем вливаем апельсиновый сок и убираем с огня  переливаем напиток в термос или оставляем в кастрюле  укутав полотенцем на  минут  затем разливаем по чашкам через ситечко и украшаем яблоком и апельсином  подавать горячим  
